name,file,platform,description,compatible_devices,features
Cisco NX-OS Base Configuration,cisco_nxos_base.j2,NX-OS,Base configuration template for Cisco Nexus switches (NX-OS),"Nexus 9508, Nexus 93180YC-FX, Nexus 9000 series","Global settings (hostname, timezone); Feature activation; VTP configuration; Spanning tree (rapid-pvst); VLAN configuration; Management interface; NTP, DNS, SNMP; Syslog logging; TACACS+ AAA; OSPF/BGP routing; HSRP (for core/distribution); SSH management access; Banner"
Cisco IOS-XE Base Configuration,cisco_iosxe_base.j2,IOS-XE,Base configuration template for Cisco Catalyst switches (IOS-XE),"Catalyst 9300-48P, Catalyst 9000, 3850, 3650 series","Service timestamps and encryption; Global settings; VTP transparent mode; Spanning tree (rapid-pvst, portfast, bpduguard); VLAN configuration (management, data, voice); Interface templates; NTP, DNS, SNMP; Syslog logging; TACACS+ AAA; SSH management access; PoE configuration (access switches); Banner"
Cisco IOS-XR Base Configuration,cisco_iosxr_base.j2,IOS-XR,Base configuration template for Cisco ASR routers (IOS-XR),"ASR 9001, ASR 9000, NCS series","Global settings (hostname, timezone); Management and loopback interfaces; NTP, DNS, SNMP; Syslog logging; TACACS+ AAA; OSPF/BGP routing; NETCONF (optional); SSH management access; Banner"
Cisco IOS Base Configuration,cisco_ios_base.j2,IOS,Base configuration template for Cisco ISR routers (IOS),"ISR 4431, ISR 4000, 2900, 1900 series","Service timestamps and encryption; Global settings; Management and loopback interfaces; NTP, DNS, SNMP; Syslog logging; TACACS+ AAA; SSH management access; Console and VTY line configuration; Banner"
Cisco IOS-XE Advanced Security,cisco_iosxe_advanced.j2,IOS-XE,COMPLETE configuration template with base features + advanced security for access/distribution switches (IOS-XE),"Catalyst 9300-48P, Catalyst 9000, 3850, 3650 series","BASE CONFIG: Service timestamps; Hostname; VTP; Spanning tree; VLANs; NTP/DNS/SNMP/Logging; AAA/TACACS+; SSH management; Banner. SECURITY: DHCP Snooping (vlan-based trust ports rate-limiting); Dynamic ARP Inspection (DAI) with validation; Port Security (sticky MAC aging violation recovery); 802.1X Authentication (multi-auth multi-domain RADIUS guest/fail/critical VLANs); Storm Control (broadcast multicast unicast); Interface auto-config (access/trunk VLAN assignment); DHCP Relay/IP Helper"
Cisco NX-OS Advanced Security,cisco_nxos_advanced.j2,NX-OS,COMPLETE configuration template with base features + advanced security for access/distribution switches (NX-OS),"Nexus 9300, Nexus 93180YC-FX, Nexus 9000 series","BASE CONFIG: Features activation; Hostname; VTP; Spanning tree; VLANs; NTP/DNS/SNMP/Logging; AAA/TACACS+; SSH management; Banner. SECURITY: DHCP Snooping (vlan-based trust ports); Dynamic ARP Inspection (DAI) with validation; Port Security (sticky MAC violation modes); 802.1X Authentication (RADIUS integration); Storm Control (broadcast multicast); Interface auto-config (access/trunk VLAN assignment); DHCP Relay"
